{"ai_quality_rubric_path":"rubrics/ai-participant/v0.1.json","candidate_rubric_path":"rubrics/candidate-behavior/v0.1.json","case_id":"exercise-c-medium-001","contract_version":"0.1","episode_path":"episode.json","exercise_id":"candidate-assessment-c-time-boxed-decision","human_inputs":{"adjudication_path":"adjudication.json","rater_sheet_paths":["rater-sheet-a.json","rater-sheet-b.json"]},"scenario_path":"fixtures/scenarios/candidate-assessment-c-time-boxed-decision-v0.1.json","state":"medium","target_participant_id":"candidate_c_medium","test_oracles":{"deterministic_rules":"deterministic-rule-result.json","evaluation_result":"evaluation-result.json","feedback":"expected-feedback.json","opportunity_resolution":"opportunity-resolution.json","system_quality":"system-quality-result.json"},"versions":{"aggregator_version":"human-adjudication-aggregator-v0.1","deterministic_evaluator_version":"exercise-c-deterministic-v0.1","feedback_template_version":"evidence-feedback-v0.1","opportunity_resolver_version":"opportunity-resolver-v0.1","runner_version":"generic-full-episode-runner-v0.1"}}
